id,created_utc,title,selftext,full_link
kfnj5q,1608306442,PNES newly diagnosed (caretaker),"Hi, everyone. Sorry if the formatting is weird, I am on mobile. I just stumbled onto this subreddit in pursuit of trying to find help for my dad &amp; I’m just looking for some support. As if 2020 couldn’t throw any more twists at us, my dad started having seizure type episodes in April. He was diagnosed with REM sleep disorder, and after many sleep studies, EEG’s, a week long stay at Johns Hopkins, physical therapy, and so many other dr visits and referrals, it seems that he has been diagnosed with PNES since the EEG shows no neurological response to his seizures or tremors, and physical therapy showed no signs of Parkinson’s (which REM is connected to). Johns Hopkins recommends Cognitive Behavioral Therapy, but after one teleconference we have kind of been left in limbo- that was three months ago. I have uprooted my life and moved across country to help my parents out since my dad can’t really be left alone, drive, etc. and my mom is an essential worker. I feel somewhat at my wits end. I fought to get him into Johns Hopkins after no one locally had any sense of urgency and very much so “it’s all in your head” shrug- who knows- mentality. I thought that JH would find a solution that would return some sense of normalcy to our lives and improve my dads quality of life, but that hasn’t happened.\n\nI guess I am just looking for some guidance and support from this community. What treatments have you all experienced? Did they work? He was on Keppra, but once they were deemed non-epileptic they took him off those meds and he is only on Clonopin for his sleep.. so as far as the seizures go, he is unmedicated as it seems nothing would help according to Drs. Has any medication helped for you?\n Is there something more I should be doing, somewhere else to go to help us? My dad has anywhere from about 15-20+ “episodes” a day, sometimes a little less, sometimes more- but that is the average. I expected to be here maybe a month and that was six months ago. Should I retrieve the rest of my belongings and call the east coast home again? Is this our new normal? Is there things I should be doing to show my dad more support, to make this easier on him? Is there something you wish someone would have done for you, or that could have made this easier when you began this journey? He retired three years ago and this is supposed to be the happy, stress free era of his life. I feel so helpless, and sometimes I just want to scream. But my stress is nothing in comparison to having your life completely uprooted by debilitating seizures, and this isn’t about me.. however I could use a hug. It is scary to see your dad deal with this. Even though I am a “grown adult”, it has been a rough transition internally to say the least. I didn’t expect to caretake so soon, to have to make these decisions. I am afraid constantly that he won’t come out of one of these seizures, or that they could be a stroke or something worse. I feel helpless in trying to get these doctors to listen. It is easy for them to say “see you in 3-6 months” when it isn’t your parent, loved one, self, going through this. With the long road yet to go, I am afraid to leave and go home and have something happen. But then my personal life is sitting in limbo as well &amp; I don’t know what is right or wrong, what is helpful or not.. which way to go at all.\n\nClearly we are all new to this and I would just really appreciate any support or guidance on what has worked for you, what we can try, anything at all really.. just to hear from people who understand these struggles would be refreshing since I feel like we are on a deserted island while life moves on for everyone else. If you made it this far, thanks so much for reading and listening to my troubles. Sending a virtual hug to you all.",https://www.reddit.com/r/PNESsupport/comments/kfnj5q/pnes_newly_diagnosed_caretaker/
k91q5p,1607422271,In the process of a diagnosis,"Hi everyone it all started when i was feeling dissociated everyday it then led to staring spells extreme confusion, feelings of my brain going on and off, flashes of light, smells indescribable feelings, weak limbs/paralysed sometimes on one side sometimes whole body, finding noises annoying or scary, general feeling of confusion. Does anyone else experience these symptoms. I am seeing a doctor just seeking some reassurance is all",https://www.reddit.com/r/PNESsupport/comments/k91q5p/in_the_process_of_a_diagnosis/
jwmyof,1605729099,Head tics?,"Hi, Ive recently been diagnosed with PNES/NEADs and I was wondering If anyone else had a reccurring head tic or head/neck jerk in the years pervious to having thier first attack? And could possibly tell me what causes it? or at least what causes it for them? \n\nthanks in advance",https://www.reddit.com/r/PNESsupport/comments/jwmyof/head_tics/
jwc1d6,1605687500,Who else gets hungry? After a seizure,"Okay, so who else comes down  from a seizure feeling thirsty and like they could just eat everything in sight?  \n\nWhen I started with chronic migraines back in 2005 I found once the pain subsided I would be hungry but once my migraines were under control the hunger did too. Now that I'm in pain again, this time due to seizures, I find the hunger is back. Can anyone relate?",https://www.reddit.com/r/PNESsupport/comments/jwc1d6/who_else_gets_hungry_after_a_seizure/
jsqe72,1605165716,What's the next step when Dr's dont know what to do??,"Okaay so I'm 23 and was diagnosed with PNES in March after almost 4 years living in seizure hell (I do also have epilepsy but the meds work for that apparently) I also live in BC (canada) if that's important to this.\n\nBut basically my appointment in March was SUPPOSED TO be the ""see the epileptologist, stay at the facility they'll hook you up with resources"" kind but turned into the ""hey we'll call you about this"" kind. \n\nAnyways, my neuro got the info after my appointment, sent a referal to a psychiatrist, and turns out no ones accepting patients and my neuro is wiping his hands of it since my epilepsy isnt the problem. And no therapists in the surrounding area even know what PNES is\n\nI guess what I'm asking overall is there like a DIY seizures-be-gone thing I could try? I just really want to actually start my life instead of being stuck because of my seizures",https://www.reddit.com/r/PNESsupport/comments/jsqe72/whats_the_next_step_when_drs_dont_know_what_to_do/
jrzsx2,1605063072,I dont know what this means,"In 2016 I started having these seizures, they consisted of left beck and shoulder spasms. I would be fully conscious and walking and talking. They pretty quickly evolved into simiconscios ei: not being able to move, talk, or open my eyes. Yet I could hear and feel everything going on around me. This only now happens sometimes. Well last week I had a seizure that was just like my first ever seizure. My boyfriend had never seen one like that, and I hadn't had one since 2016, I was very confused. Anyway... thats all, I just wanted to get it out there.",https://www.reddit.com/r/PNESsupport/comments/jrzsx2/i_dont_know_what_this_means/
jr1e64,1604941237,Seizures in Sleep,Does anyone get seizures occasionally when they're half a sleep in bed? Sometimes I'll even jolt awake and then have one.,https://www.reddit.com/r/PNESsupport/comments/jr1e64/seizures_in_sleep/
jnovpk,1604458823,Officially diagnosed,"Today, I had an appointment with my family doctor to address my possible seizures and other symptoms. She confirmed that I am having PNES attacks and referred me to a neurologist right away.\n\nWhat should I expect to come out of my neuro appointment? I know they will most likely do an EEG, but from everything I have read, PNES does not show on these type of tests. \nWill they simply rule out epilepsy and refer me to a psychiatrist? \n\nAlso, is it possible to receive help from social security due to my attacks being so intense and extensive?\n\nAny insight or support is appreciated. I'm upset that I'm challenged with this disorder but atleast I'm on some sort of path to receive help.",https://www.reddit.com/r/PNESsupport/comments/jnovpk/officially_diagnosed/
jlq10s,1604177994,General questions/support:,"I believe I have PNES. I was in a terrible car accident in 2015, almost died, and had a traumatic upbringing. I recently started smoking weed fairly often. I had my first ""trip"" and have never been more scared in my life. I black out, disassociate, come back to reality and am hysterically crying, my vision then hyper focuses to what feels like eternity. At this point I am completely spaced out and unresponsive to the outside world. I convince myself this is what death/acoma is like. I start having tremors, mostly in my legs, and make repetitive motions. This lasts for several hours. I am completely unaware of who I am, where I am or what is happening. I slowly start to come down and tend to repeat myself to whoever is with me at the time. For a few days afterwards, I am unable to properly function.\nThis has happened 3 times after smoking dispensary grade weed and once when I was stone cold sober.\nI recently went through a very, very hard breakup and know the stress is a contributing factor. \n\nAre these valid symptoms? Does anyone have similar experiences? Is there a cure? Any information or support would mean the world to me. I feel like I am lost.",https://www.reddit.com/r/PNESsupport/comments/jlq10s/general_questionssupport/
jk5g47,1603955241,Well this sucks,"So I kind of never went to a psychologist before, but I have some problems in that department. Anyway 8 hours ago I started seizuring. It lasted 45 minutes. I didn't want to go to the ER, but a friend(I live in student housing) said no, you're going idc. He made a wise choice  because I seizured 8 more times in the last 8 hours. I also having laughing fits during them. The doctors after seeing me and bringing in some psychologists and consulting with a psychiatrist said it's not epilepsy, it's very very likely to be PNES. I'm not distressed by it(probably bottling up more stress), but it seems very annoying. I don't lose consciousness or anything and I can still speak(sometimes,unless I can't stop laughing or clenching my teeth or both). This came out of nowhere. Any advice?",https://www.reddit.com/r/PNESsupport/comments/jk5g47/well_this_sucks/
jjubo4,1603912649,Just Curious...,Has anyone had any luck with SSI/Disability with PNES? \n\n[View Poll](https://www.reddit.com/poll/jjubo4),https://www.reddit.com/r/PNESsupport/comments/jjubo4/just_curious/
jgbyc7,1603411779,My seizures begin with an aura - this is digital art I made of how they seem to me,,https://www.reddit.com/r/PNESsupport/comments/jgbyc7/my_seizures_begin_with_an_aura_this_is_digital/
jcphcj,1602911973,How do you cope with your partner's PNES?,"My husband recently received a dual diagnosis of epilepsy resulting in grand mal seziures, and PNES causing multiple focal seizures on a daily basis. As the caregiver of my soul mate, I'm struggling to cope with the onslaught of stressors. I've started therapy, which is helping, but what do *you* do to cope with the onslaught of stressors?",https://www.reddit.com/r/PNESsupport/comments/jcphcj/how_do_you_cope_with_your_partners_pnes/
jba2b4,1602711054,Another one,I just had another seizure about 5 minutes ago. I am wiped. For me they are triggered by my anxiety. I start laughing nervously then the laughter goes out of control and i will either lose consciousness and briefly feel my whole body shaking or I will just feel my whole body shaking. To the naked eye though external observers don’t see my shaking. After I regain consciousness I just feel wiped. Right now my chest hurts and I have a lump in my throat. I’m exhausted you all.\n\nI’ve had three EEGs and only able to capture one episode on the EEG with no unusual brain activity detected for the 48 hours I had the device on.,https://www.reddit.com/r/PNESsupport/comments/jba2b4/another_one/
j5mpux,1601915726,My journey with PNES,"I was at the point where I was seizing every week. I couldn't function after. No one knew what it was caused by. Dozens of VEEGs showed no activity. A year later, I got it under control and am now one year seizure-free. You can do it!!! I have faith in you!",https://www.reddit.com/r/PNESsupport/comments/j5mpux/my_journey_with_pnes/
eubou5,1580068083,Afraid to shower,"So I have PNES, obviously, along with anxiety, depression and PTSD which all contribute to me having a seizure. Because of all these things, I’m afraid to take a shower. I’ve had a seizure in the shower, and thankfully I was able to lie down because I could feel it coming. But it’s still scary. So now I’ve decided that I’m only going to take baths. At least for the foreseeable future.",https://www.reddit.com/r/PNESsupport/comments/eubou5/afraid_to_shower/
eofpiy,1578973300,How's long until symptom free,My life is kind of spiralling out of control and I suspect I'll be lucky to retain my support network until the end of the year.\n\nHow long does it take to get symptom free? How long does it take to put your life back together?,https://www.reddit.com/r/PNESsupport/comments/eofpiy/hows_long_until_symptom_free/
emp01h,1578651000,Acting drunk or loopy after seizure,After I have a really big seizure I start acting kinda dru k or like loopy af like I had a big one like 30 minutes ago and now I’m over sharing and laughing at everything and still not fully cognitive and does tv is happen to anyone else because I just told my boyfriend stuff I’ve always wanted to tell him but never actually would ya know,https://www.reddit.com/r/PNESsupport/comments/emp01h/acting_drunk_or_loopy_after_seizure/
emgaq8,1578605334,PNES from TBI? Tryptophan???,"Hi folks, I wanted to share something with this community, in case it’s helpful for anyone. I warn you now: I’m prone to over explaining, but I think it might be justified here. Read on! \n\nAbout a year ago, I sustained a head injury and began having non-epileptic seizures. These have been diagnosed by the top epileptologist in my region of the country. His actual diagnosis was PNES, but the P part of this diagnosis never made sense to me as my accident, while frustrating and at times upsetting, never seemed to rise to the level of “traumatic” that would cause me to develop a conversation disorder. Because of the nature of my accident, I spent months working with a psychologist to prevent the development of any type of PTSD. He also agreed that the conversation disorder diagnosis made no sense to him, as I was handling things well overall, and showed only normal anxiety about my condition, and I wasn’t subverting emotions or anything of that sort. CBT did nothing for my seizures. So I thought: okay, these may not be epileptic seizures, but they’re also not psychogenic. So what are they? And how can I treat them? \n\nI am a former teacher, I’m very familiar with research techniques. I’m also someone with a different rare chronic illness, so I know how to do a bit of medical research. I dived in. Why not? I couldn’t work, so I had time to sort through what I found. \n\nI quickly learned that there’s very little consensus among psychologists that these seizures are *always* psychogenic. My psychologist also did some research and came to the same conclusion. There are scientists in Europe who believe that these seizures, in mTBI patients, may be the result of sub-epileptic scarring or changes in the white matter of the brain. I spent months looking at medical papers and trying to follow the various courses of study (no small feat with a head injury that made reading and remembering what I’d read difficult), but I was motivated. \n\nThen accidentally, I stumbled on something that has had startling effects for me, but I think the idea that this isn’t always psychogenic in nature is key to why I was open to the idea. \n\nAbout a month and a half ago, I developed a head cold. At the time, I was having between 2 and 20 seizures a day. Mine involve intense head pain and pressure and visuals near and in my left eye, accompanied by periods of uncontrollable “crying.” They’re more annoying than dangerous, but they do leave me exhausted and affect my cognitive recovery. My cognitive injuries suggest that my head injury affected the right frontal, temporal and possibly occipital lobes, so pain and visuals on the left side make sense. Sleep makes a difference, and my head cold was keeping me awake, so I got some Mucinex D at the store to help me stop coughing all night. Mucinex D is guaifenesin plus pseudoephedrine, or Sudafed. \n\nThree days in, I realized I hadn’t had a single seizure since I started taking it. WTF?\n\nSome googling led me to the fact that both the medications in Sudafed and Mucinex are serotonin boosters. Given that the only drug treatment for PNES is SSRIs, or anti-depressants, I thought: “bingo! This must be serotonin related! I’ll go look it up and get an answer!” How wrong I was. While there are many articles noting that SSRIs seem to work sometimes for PNES patients, I noticed a startling lack of research into WHY that was true. I think this is because these seizures are seen as psychological in nature: of course SSRIs work, right? These folks are just struggling with mental health and SSRIs are how we treat that. \n\nThe complete lack of curiosity into why serotonin affected these attacks was maddening. What if it’s *not* because this is a mental health issue? What if it’s a physiological issue that also involves serotonin? But then I remembered that neurologists don’t know what these seizures are, why they happen, or even if they’re neurological in nature. So I guess once we get handed off to psychologists, they just don’t bother anymore with the neurology of our issues. *end rant*\n\nHere’s the thing: I can’t take most SSRIs, due to an issue with how the enzymes in my liver process medication. So I wondered... how can I boost my serotonin levels naturally? I decided, after reading more, to try boosting my tryptophan levels. I started reading about eating a combination of protein-rich foods for tryptophan and carbohydrates to help me synthesize it. And guess what! It worked! Sort of. I’ve always had intense seizures after eating (another sign to me that these weren’t psychogenic was that all my triggers were physiological processes: eating, not eating often enough, lack of sleep, too much motion/visual stimulation, certain sounds, physical pain, and illness) and if I ate the carbs with my proteins, I stopped the after-food seizures! \n\nOkay, so now I was really intrigued. I decided to try modifying my diet for a week or two to see what I could do just through diet. It worked beautifully... on my food-related seizures. But not on the others. \n\nThen I made the mistake of ordering a margarita. I ordered a “weak” margarita at a local Mexican restaurant, but the waiter misunderstood me and brought me the strongest margarita known to mankind. I have had some alcohol since my seizures began (not much of a drinker, but every now and then) and been fine, but this drink sent me into seizure city! After I sobered up, I wanted to know why. \n\nThe answer is that agave-based alcohols have a unique effect on the production of tryptophan, reducing it pretty dramatically. \n\nThat’s when it hit me. What if the answer wasn’t serotonin? What if it was tryptophan? I mean, if this was purely a serotonin issue, I’d probably be having other effects, on my mood and on my sleep. But I’m mostly stable emotionally, even reasonably cheery for my circumstances, and I sleep okay. So I looked up tryptophan and discovered something called the Kynurenine Pathway (KP). \n\nNow, I’m not a neurologist, and this shit is super confusing, but basically, 5% of your tryptophan goes into serotonin and melatonin production. The rest goes into the KP. Tryptophan gets converted to Kynurenine, which then gets converted into various substances. Get enough tryptophan, and the body produces substances that are good for the neurons in your brain. Don’t get enough, and it produces substances that are very bad for your brain, causing inflammation and other issues. Disruption of the KP has been implicated in brain diseases like Alzheimer’s. There’s evidence that brain injuries can disrupt this pathway too [(see this article). ](https://www.ncbi.nlm.nih.gov/m/pubmed/26025142/)\n\nSo I thought: “I should take some dang tryptophan.” I bought a bottle at my local supplement store with the lowest dosages I could find: 500mg l-tryptophan. I started with a single dose before bed. Lo-and-behold... no morning seizures. \n\nSo I upped the dose to 500mg in the morning, and 500 mg at night. This lowered my daily seizure load from 2-20 to 0-2! I went days without seizures for the first time in a year. It also makes the seizures much less severe. Obviously, it didn’t 100% control them. I tried treating unusual bursts with extra tryptophan, but it’s not an instant fix. It seems to require a build-up over several hours to have any effect, and several days to really work. I think, and again, I can’t prove this, that my body naturally fills my tryptophan needs in terms of serotonin just fine, but then the extra-needy KP demands more and I just don’t have it, so... seizure. Give it the extra tryptophan, and it’s happy. I’m sure this also helps with my cognitive recovery as well. \n\nAt the end of the first month, I was near running out, so I ordered more online. The order was delayed, and I ended up with a couple days with no tryptophan. The seizures roared right back by the first morning without it. \n\nAnyway, I’m back on it today, and three hours after the first dose, I do feel a bit better. I’m going to try raising the dosage at night to see if that gives me a bit more protection during the day, when I need it most. If that doesn’t work, I’ll up it in the morning. I’m still way below the max dosage for tryptophan (which is about 5 grams, or 5000mg). The only side effect I’ve noticed is that it makes the blurred vision from my head injury worse, but at this time, as I’m not driving, I prefer this side effect to the seizures. \n\nAnyway, that’s my journey so far. Note: don’t try this if you already take a serotonin-boosting med, like an SSRI, as it can make you very ill. But if you don’t take anything on the interaction list, it might be worth trying for folks here. If you do, please let me know how it goes!",https://www.reddit.com/r/PNESsupport/comments/emgaq8/pnes_from_tbi_tryptophan/
ejxijj,1578149573,Yee Haw Im Worried,"Hi, I started having seizures March of 2019, stopped for months then picked up in August. I was diagnosed with PNES October 11th after an EEG, MRI, and I did an overnight stay in an epilepsy ward thing to fully tell. \n\nFrom what I know I can’t pinpoint almost any causation for them. Im a college student and engaged. The kicker? I’ve had Anxiety, OCD, and Depression since I was 7. (Anxiety and OCD was diagnosed when I was 15, Depression when I was 18) But I was never brave enough to talk about that stuff until I was older henceforth the late diagnosis. Im 19 almost 20 so life is stressful as is. What I notice cause episodes the most are:\n\n• Stress about School\n• Stress about money since I support myself \n•  Anything that causes my anxiety/OCD\n\nWhen I have a seizure my right leg starts to shake and then the rest of my body follows. I can’t talk nor breathe. I start to cry most of the time then I’ll physically hit myself in the head with my fist as hard as I can. Once its over I don’t remember anything. I can’t tell you who I am, where I am, my age, nothing. And that last for a good 3-5 hours. Then I still dont. I have days even weeks of my memory just blank because of this. \n\nIts important to note I will either have many in a span of days/weeks or have not a single seizure for months.\n\nI still can’t drive due to my home life and now PNES so that doesn’t help me much. I work on campus and I don’t even make enough to get groceries half the time thanks to my medical bills. I want to get a second job but have no way off campus to get one. My Fiancé helps as much as he can but we just got in a car accident Dec. 29tg and the car is totaled. I want to apply for disability but I’d feel like Im taking advantage of the government... Plus I want a medical ID bracelet since I can’t communicate whats wrong when I have a seizure..\n\nI just have a lot to worry about and I want to do my best to not only provide for me and my fiancé but to be in a better state of mind.",https://www.reddit.com/r/PNESsupport/comments/ejxijj/yee_haw_im_worried/
ee1raz,1576996819,Hi!,"I'm new to this sub, just joined, in fact. I'm 14, and gender fluid. I was diagnosed with PNES in the fall of 2018, and have been struggling. I've done a lot of travelling this year, compared to what I normally do. I went to Ireland and Florida, and for a Californian, it was rough. Don't get me wrong, I love travelling. I also have a question. If there is someone in your life who you believe is a large trigger for you who is family, how would you deal with it?",https://www.reddit.com/r/PNESsupport/comments/ee1raz/hi/
