id,created_utc,title,selftext,full_link
e40aqm,1575136004,Getting a job with PNES,Hello everyone! I was diagnosed about two months ago and had to drop basically my whole life when it first started. I am incredibly depressed and unhappy sitting at home without an income and removed from anything that feels like an accomplishment. I really am dying to get a job but have been hesitant due to the major stress I’ll have about having a seizure at work. Anyone have any tips with this? I don’t plan on telling my employer until after I’m hired but even then am nervous about getting fired for that reason and them claiming it was something else.,https://www.reddit.com/r/PNESsupport/comments/e40aqm/getting_a_job_with_pnes/
e243wg,1574800765,THANK YOU for making this sub! I've gone from epilepsy to PNES...,"I was diagnosed with complex partial epilepsy when I was 17 in 2007. It took me ten years to finally get comfortable with that diagnosis and all that comes with it (not being able to drive, having to alert workmates and educate people about first aid etc).\n\nThen in 2018, I went to one of the top epilepsy clinics in Australia and WHAT DO YOU KNOW. My diagnosis got revised to PNES. It's been a bit of a mindfuck (no pun intended) getting used to this new name for the thing I've got, realising I'm not one of the epilepsy gang, and telling all my friends and family about the differences that come with the new diagnosis. I'm currently unable to work because it flares when I'm even vaguely stressed, but I'm happy to say I'm settled with the new terminology, I've got the best neurologist ever, and \n\nHowever, no longer being classed as epileptic has made me feel kind of lonely. I was a member of a lot of forums and organisations, and was really keen to spread the word about it to try and build awareness, and now I feel like a bit of a fraud. Add to this the fact that I'm stuck living at home with my parents, unable to work at the age of 30, hundreds of kms from my friendship networks, and tbh things are all a bit stink. I was at a loss for where to turn for support and I was pretty lost as to where to start looking.\n\nSo HEY! Thanks for being amazing and creating this space!",https://www.reddit.com/r/PNESsupport/comments/e243wg/thank_you_for_making_this_sub_ive_gone_from/
e1p66s,1574725827,Acomplishment,"I applied for disability almost a year ago, it got denied, so my lawyer and I appealed and got a hearing. That hearing was today. I have PNES (classified as conversion dossorder) GAD, PTSD, and bipolar disorder. My anxiety was super high, and I choked in the begining of the hearing, but I did good. It was an amazing accomplishment, and I'm so proud of myself. I'll know the decision in a couple of months, send me good luck?",https://www.reddit.com/r/PNESsupport/comments/e1p66s/acomplishment/
e1kkl9,1574707712,Headaches,Any one have  any suggestions to relieve headaches associated with PNES ? Motrin and Tylenol won’t touch it and 2 weeks out from Dr apt.,https://www.reddit.com/r/PNESsupport/comments/e1kkl9/headaches/
dt9hwz,1573183979,PNES - the diagnosis of what you DON'T have 🤦‍♀️,"41 years old, never had a seizure in my life till just a few months ago. Have had close to 50 since. Never suffered from depression, anxiety, PTSD, or any of the other triggers contributing to many seizures I've read about. Always been physically active with running, biking and lifting. Clean eating with plenty of rest. \n\nTriggers appear to be the following:\n\n1. Ovulation \n2. Start of period\n3. Strenuous exercise (1 mile steep incline cause seizure where 70 miles flat does not)\n4. Running after mile 3. Inclines make it worse\n5. Forgetting a meal\n\nAnyone else in this category scratching their head?\n\nAnd, none of you are crazy! Please don't believe those words if told to you. This is real. It is not within your control, but we are all searching for a way to control. If not all of it, at least some of it.",https://www.reddit.com/r/PNESsupport/comments/dt9hwz/pnes_the_diagnosis_of_what_you_dont_have/
dt699m,1573168813,Dis-association and PNES,"My wife suffers from Dis-associative Identity Disorder, along with anxiety and severe depression.\n\nShe is suffering daily Seizures and sometimes 2 a day, it is wearing her down physically and mentally.\n\nFrom my research I advised her Psychiatrist prescribe Sertraline and I am trying to find a psychologist who can handle her particular mix of illnesses.\n\nApproximately 2 years ago the seizures were few and far between mostly brought on by a compelling event.\n\nFrom what I am understanding recently it's a battle occurring between two other personalities. She has a strong Male protector personality and she has this other personality she refers to as negative i.e. wants her to do things that are out of character.\n\nThe onset of the seizure starts with severe yawning which begins a series of painful reflexes in her shoulders and arms she describes it as if her insides where being twisted. When a full blown seizure occurs, her body locks up rigid, and her hands will curl inwards and twist, jaw will be locked tight I have try and make sure her tongue is not between her teeth. In most case the seizure can be partially avoided by giving her Ativan or Loreazpam  ahead of time, if she sees the symptoms in time. Even in those instances she will suffer a partial shorter seizure. \n\nShe is loosing the will to live, I am at a loss to see what I can do to reduce her symptoms. If anyone can offer some advice or alternative therapy please do.",https://www.reddit.com/r/PNESsupport/comments/dt699m/disassociation_and_pnes/
dr5xxm,1572811820,What did doctors think you had before you were diagnosed with PNES?,In order of diagnosis mine were:\n1. Muscle strain\n2. Tourette's\n3. Psychosis\n4. Epilepsy\n5. and finally PNES,https://www.reddit.com/r/PNESsupport/comments/dr5xxm/what_did_doctors_think_you_had_before_you_were/
dpb8ob,1572462679,Is this PNES?? Super confused and scared,"Hey everyone. I am new to this world and having been waiting for weeks to meet with the neurologist (going in tomorrow) I haven’t been diagnosed with PNES yet but have been told from Er doctors that it’s what it is, and based upon what happens during my seizures(they’re long and happen in clusters, I’m conscious the whole time). I have some questions though. \n1. I have never been stressed before a seizure has started, and they actually often time get triggered from me orgasming. Anyone else have that? I don’t understand how it could be stress or trauma related if I’m feeling absolutely fine. \n2. I sometimes  can’t breathe for a while or struggle through super shallow breaths during my seizure. Anyone else experience this?\n3. Lately I’ve started experiencing cognitive effects, which is totally new. I space off and realize I really can’t think. I’ll stare dead into space for a bit, not moving, and then usually fall into a seizure. Though last night after I had been constantly going in and out of a seizure for almost two hours, I had a little break but then suddenly lost the ability to move or talk. I didnt fall over and could control my eyes, but couldn’t talk or move much of my body. That lasted for about 5 minutes. Super weird! It was pretty scary to just not be able to talk but could stare into my bf’s eyes and move my hand.\n4. Do you have any suggestions for important things to ask my neurologist tomorrow??\nThanks everyone!",https://www.reddit.com/r/PNESsupport/comments/dpb8ob/is_this_pnes_super_confused_and_scared/
dn2hhl,1572031830,Any Advice or Thoughts on my Situation?,"Hi. I’m a 19 year old male with complex PTSD. I have really bad episodes that consist of uncontrollable twitching, screaming, crying, flailing, shaking, and so much more. My vision gets blurry and I stumble on and repeat my words. Basically everything that happens in a typical seizure is happening. They happen in bursts, sometimes I’ll have them a lot but then they’ll die down after a while and then start back up again. When I’ve been to the hospital, they’ve told me it was a form of Tourette’s and then it was Motor Tic Disorder. The other thing is that I’m fully conscious during them, I am aware of what is happening, but I can’t control anything my body is doing. They’ve taken a huge toll on my life as now i am scared to go out in public and have an episode. I have them 2-3 times a day and they’re physically and mentally exhausting on my body. I recently met someone on reddit who has PNES and after talking to her quite a bit I discovered that may very well be what is happening to me. I have contacted my doctors but they have never heard of PNES and are trying to look into it. I have an appointment with my doctor coming up where I will see if the doctor can refer me to a neurologist, and then hopefully get this figured out. Does anyone have any advice or thoughts? I’ve just been feeling super alone in this and would love some support from people who understand.",https://www.reddit.com/r/PNESsupport/comments/dn2hhl/any_advice_or_thoughts_on_my_situation/
dkcxkg,1571534757,Pain relief.,So I just had a the pleasure of picking myself up off the floor after falling off the bed due to seizure and the first thing I reached for was my tiger balm for my aching muscles.\n\nWhat remedies does everyone use to relieve the aches and pains that PNES bring?,https://www.reddit.com/r/PNESsupport/comments/dkcxkg/pain_relief/
