id,created_utc,title,selftext,full_link
p0mmof,1628455601,After seizure pain,Hey all.\nJust wondering what you guys do after a seizure? My brain seems fried and my body in pain. Having a diagnosis is great- but so little that can be done to help the symptoms or even events.. 😭,https://www.reddit.com/r/PNESsupport/comments/p0mmof/after_seizure_pain/
p03nbr,1628378353,Thoughts on EMU,has anyone been admitted? What was your experience?,https://www.reddit.com/r/PNESsupport/comments/p03nbr/thoughts_on_emu/
orbpu7,1627220298,clonazepam,"Had anyone taken clonazepam? Any stories for me? I’m an « exquisitely  difficult case » because I also have chronic anxiety, and premenstrual dysphoric disorder. It’s helping me SO much, but from what I gather it isn’t meant to be taken in the long term. Sending love and strength.",https://www.reddit.com/r/PNESsupport/comments/orbpu7/clonazepam/
or9lok,1627211014,Nighttime/Morning seizures,"Been having a rough time. Had a seizure right before bed for 30 min, now I’m awake and having another. The people I live with seem fed up with me. Really need help but too scared to ask.",https://www.reddit.com/r/PNESsupport/comments/or9lok/nighttimemorning_seizures/
oofzkm,1626831265,Diagnosed in March--World turned upside down,"I'm so glad I found this subreddit. After years on r/epilepsy and finding out my diagnosis I felt so alone. I felt such shame and embarrassment. Even though after dozens and dozens of 'normal' EEGs and given my past history I did start to have some suspicions. \n\nI went roughly five years being told I had myoclonic epilepsy and then just temporal lobe epilepsy. I was on Keppra and Lamotrigine. Now I'm not. There was an improvement in mood at first but the stress of the new diagnosis and accepting this part of myself has been extremely hard. The seizures still come and I still can't work/drive. \n\nI have started seeing a therapist to try and address this but while it's helpful for many of my other issues, thus far I haven't gotten much better with seizures.\n\nFinding hope is hard. And it has definitely been a struggle lately.",https://www.reddit.com/r/PNESsupport/comments/oofzkm/diagnosed_in_marchworld_turned_upside_down/
ojqfjt,1626214730,Fitness &amp; seizures,I’m trying to get into fitness to suppress my daily exhaustion. I am anticipating to return this fall for the senior year of college. I opted in for the in person education because I found it worth it. I am worried about my physical health effect my seizures. I admit I have experienced less since being on Zoom University but it’s not quality education. I am not sure where to start and how much “physical activity” is too much. Does anyone have advice on how to manage fitness with PNES?,https://www.reddit.com/r/PNESsupport/comments/ojqfjt/fitness_seizures/
ojqcrr,1626214480,Are you physically active?,\n\n[View Poll](https://www.reddit.com/poll/ojqcrr),https://www.reddit.com/r/PNESsupport/comments/ojqcrr/are_you_physically_active/
oj2u00,1626131218,PNES medical card,Can someone link where to get a PNES medical card?,https://www.reddit.com/r/PNESsupport/comments/oj2u00/pnes_medical_card/
oh4vqw,1625865311,“Clover” unleashes themself and stops traffic after their owner has a seizure!,,https://www.reddit.com/r/PNESsupport/comments/oh4vqw/clover_unleashes_themself_and_stops_traffic_after/
oejjxx,1625529874,The looming sense of dread,"Does anyone else feel like they are dealing with the dread of the unknown and the fear of your own looming sudden death? \n\nThis is sometimes how I feel. That my body has been sending signals for the past year that something is wrong. The seizures are a warning sign of something that isn’t working on the inside properly. It’s giving me notice that I’m short circuiting. But from all quantitive tests to date, this is false. No abnormalities detected. \n\nI attempted to tell the doctors my symptoms. I do therapy, I follow treatment recommendations. I accept the diagnosis of PNES; I’m aware of ways to mitigate the intensity, I take action to better my overall health and well-being. \n\nI’m grateful for this community and reading everyone’s thoughts, feeling and experiences. It does help in these moments of doubts. Right now I am having them; the overwhelming sadness that comes from the daily struggle of twitching, laboured breathing, confusion, disorientation, and agitation. \n\nThe tightness in the chest, low heart rates to sudden spikes. The inability to speak, but make odd noises. \n\nJust wanted you to know, you are not alone. This sometimes sucks. But everything in life has its ebb and flow. \n\n“The beauty of the sky can ease all of life’s woes.”",https://www.reddit.com/r/PNESsupport/comments/oejjxx/the_looming_sense_of_dread/
oclpkj,1625266807,My husband is having non-epileptic seizures and we're thinking it could be pnes. This is a video of one of his episodes. Thoughts?,,https://www.reddit.com/r/PNESsupport/comments/oclpkj/my_husband_is_having_nonepileptic_seizures_and/
obloho,1625145558,Wondering what these are?,"I’ve had two things occur this week, never happened before as best I know. I was walking during both and everything just was black. I was gone. On the first occasion, I came back after roughly seven seconds. I was behind lots of people I’d been ahead of but still in a different spot then where I started. The second time was only a second or two but I think I stopped walking and then started again when I was back. \n\nA friend told me it might be PNES. It’s worth noting I do suffer from anxiety. Can anyone tell me what this might be? I’ve only had one diagnosed seizure before as a side effect to medicine when I was 8, but I’m no longer on it.",https://www.reddit.com/r/PNESsupport/comments/obloho/wondering_what_these_are/
o9rnhs,1624908973,Non epileptic seizures,"SO my eye has been twitching on and off for hours, I can't form sentences, tremors are bad, I think Im in panic attack mode- am I seizing?",https://www.reddit.com/r/PNESsupport/comments/o9rnhs/non_epileptic_seizures/
o9qf40,1624905315,twitchy,My right eye bag (yep bag) has been twitching a lot.  I'm stressing but in good spirits.  I have a panic attack every day in the afternoon.  I'm in poor health.  I hate this.,https://www.reddit.com/r/PNESsupport/comments/o9qf40/twitchy/
o8horf,1624736801,My therapist shared this awhile ago - polar bear shaking off distress. It’s strangely validating. I wanted to share this with y’all.,,https://www.reddit.com/r/PNESsupport/comments/o8horf/my_therapist_shared_this_awhile_ago_polar_bear/
o7m3b7,1624621678,How to differentiate between excuse making and acceptance.,"Hi. I've just recently been diagnosed with PNES (I made another post about a week ago) and this morning I called in for the umpteenth time. Felt overwhelmed partially by some symptoms this morning, And also just dread because of a bad spell I had yesterday. I still felt like i could have pushed through today, but I called in. Does anyone know the best way for dealing with this/how to hold oneself accountable without being too harsh/unreasonable?",https://www.reddit.com/r/PNESsupport/comments/o7m3b7/how_to_differentiate_between_excuse_making_and/
o4p5c3,1624258166,Tongue,"Hello. I don’t know how many people experience this but lately my tongue has been sticking out? I know this is common in people that have epilepsy but I’m concerned what this might mean for people that have PNES. I’m 50% aware when I am having an episode so I can tell and I also record myself in case something new comes up. I’ve experiencing my eyes rolling back, arched neck, drooling and tongue sticking out and biting it on the right side. Kinda of scared 🙂",https://www.reddit.com/r/PNESsupport/comments/o4p5c3/tongue/
o35vxg,1624068729,Dehydrated,"Hi, I was wondering If anyone has a seizure if they are slightly dehydrated, or maybe it’s the warmer N.J. temperatures?  My seizures didn’t start till Dec, 2020 ( 53 f ) so I haven’t had this condition in the spring -summer.  I’m not working or driving now, so I walk everywhere.  I’m in the process of applying for S.S. D.  I’m about to start in a pilot study to determine effective treatments for PNES.  Any ideas  are greatly appreciated.  \nThan you very much for your feedback.",https://www.reddit.com/r/PNESsupport/comments/o35vxg/dehydrated/
o1ob7m,1623903693,Do you have the ability to drive?,\n\n[View Poll](https://www.reddit.com/poll/o1ob7m),https://www.reddit.com/r/PNESsupport/comments/o1ob7m/do_you_have_the_ability_to_drive/
o0qydl,1623798087,Does anyone else feel like they're faking it?,"I've seen a lot of people talking about others accusing them of faking PNES (I was diagnosed about a month ago) but I can't seek to shake the feeling that I am faking it-i think I like the attention sometimes, but the siezures are really happening. Like today I started jerking from  the waist up or so at work (and gasping audibly sometimes) and it just seemed like it was happening at times that were really convenient for me- does anyone else experience guilt for PNES specifically like there's something disingenuous/exaggerated about their siezures? It's such a weird grey area that I have no idea what to think about them (I almost lost my job and ended up dropping classes/other things like that as a result, which are outcomes I do NOT want-I want to be productive, independent, nor excuse making- but it doesn't feel like there's a difference between them ""happening to me"" when I move as a result of them and when I consciously move my body- say my hand. Other times I fall down (which I've never fully done except when alone) and i think ""this is ridiculous. I'm perfectly capable of getting up"" but I just... don't. Does anyone have any advice?",https://www.reddit.com/r/PNESsupport/comments/o0qydl/does_anyone_else_feel_like_theyre_faking_it/
nxk7ht,1623429327,How long does/can an episode last?,"My daughter (14) has recently been diagnosed with PNES.  Normally her episodes only last a few minutes, but today she has had an episode lasting an hour.\n\nI understand that an extended episode isn't physically dangerous (in the way a long epileptic seizure might be).  But what's your experience of how long a PNES episode lasts?  Is an hour or more ""normal""?",https://www.reddit.com/r/PNESsupport/comments/nxk7ht/how_long_doescan_an_episode_last/
ntl4m6,1622984102,Service dog for PNES?,"I’m looking into possibly getting a service dog for my PNES. Animals have always calmed me, and I always feel really unsafe when I’m alone and these seizures happen. Plus, I want to have a companion to go through all of this with. My friends don’t really get my condition, and they all just pause and change the subject whenever I bring it up. I feel so alone. Any thoughts on my decision? Am I doing the right thing?",https://www.reddit.com/r/PNESsupport/comments/ntl4m6/service_dog_for_pnes/
novck3,1622439079,Is this PNES or epileptic seizure?,"My teenager daughter had a tonic clonic seizure during the weekend and I managed to video it. Waiting to show it to the neurologist during the next appointment, which is in three months times.\n\nHer neurologist suspected that she has both PNES and epilpsey. Not yet confirmed without showing her the seizure video.\n\nThe recent seizure, I observed that my daughter's mouth was wide open, with systematic facial twitching (on both sides of the face). Do epileptic seizure shows tightening of teeth, since I read some actually bite themselves?\n\nMouth wide opening = PNES?\n\nThanks",https://www.reddit.com/r/PNESsupport/comments/novck3/is_this_pnes_or_epileptic_seizure/
nnoxmo,1622299538,Can tics mimic absent seizures??,"I dont know to explain this... Well you guys already know what those look like so what i feel/do in my body is my eyes will do many things like stare or like ill stare to a side and my head turns with it they will blink or flutter or they with close and then roll or strain themselves whatever they do, also my head will hurt (also i yawn almost every time that happens... But the could be by the eye strain right?) and i just feel ill and just disorientated also my head/ neck will feel weak or i just dont feel connected to my body the more it happens the worse ill feel, the reason im pretty sure its not a seizures is because i have never passed out . So i also have tics im thinking maybe thats just some stranger complex tics or maybe idk actually got no idea\n\nSo sorry if non of that makes sense, i hope you all have an wonderful day or night🌻",https://www.reddit.com/r/PNESsupport/comments/nnoxmo/can_tics_mimic_absent_seizures/
nh2z86,1621524004,does anyone know what this is?,"i’ve recently been getting a thing where my eyes roll back and then sometimes my had drops during this. i can hear what’s going on around me but can’t talk and only partially remember what just happened, i’m aware of what someone said if they’re talking to me but i sometimes struggle to remember once i’m back again. (i have tourettes btw idk if that helps)\n\nhttps://vm.tiktok.com/ZMetcut7H/\n\nit looks exactly like this but i’m not diagnosed with fnd so don’t want to jump to conclusions, also i didn’t know how to attach the video directly lol",https://www.reddit.com/r/PNESsupport/comments/nh2z86/does_anyone_know_what_this_is/
ngwmev,1621506587,Cheek biting/sleep symptoms,"Does anyone else have symptoms in their sleep? Such as cheek biting, twitching, choking in sleep, sitting up in bed etc etc etc",https://www.reddit.com/r/PNESsupport/comments/ngwmev/cheek_bitingsleep_symptoms/
n90mjh,1620640067,New to this need some help,Hi I just had a pretty bad seizure and I need to know if they happen again after a recent one. Ty,https://www.reddit.com/r/PNESsupport/comments/n90mjh/new_to_this_need_some_help/
n6ozyx,1620357169,PNES and Spine Problems?,"TL;DR - Can you have BOTH PNES and issues with your spine?\n\nHi All - I had a hospital stay 11/2020 that started because I thought that the difficulty walking and tremoring/shaking was from my old friend “Degenerative Arthritis of the Spine”. I’ve had a couple of surgeries, and when it’s time for surgery I get these symptoms (myelopathy) and dystonia. Well, this time around, they said it wasn’t my spine, it was PNES. At least that’s what Neurology said. Neurosurgery isn’t sure, but they found some instability in my spine. Physiatrist (Rehab) says no, it’s your spine. Therapist says no, you have some anxiety and a history of trauma, but you don’t have PNES. \n\nI don’t get these symptoms often, but when I do, it’s horrible. Not a minor tic or some tremors, I look like I’m having a Grand Mail seizure, but I’m awake and alert and just going along with the ride til my body settles down. Any thoughts? Anyone else in this situation?",https://www.reddit.com/r/PNESsupport/comments/n6ozyx/pnes_and_spine_problems/
n6nsga,1620353151,Should I give up on my dream?,"Hi everyone, hope you are all well.\n\n&amp;#x200B;\n\nI have always wanted to work in healthcare. I was diagnosed early this year but started getting PNES in late 2019. I have always felt the need to be able to help people on a  daily basis in a hands-on manner. I am in the beginning stages of this journey and am interviewing for low level healthcare jobs. I also plan on going back to school and taking classes I need to continue into the profession I want. However, now I worry that I will not be able to do so. Healthcare jobs are usually high stress and have long hours, hours of being on your feet, etc. Should I give up on my dream? I'm very sad to do so but I have no idea if I will ever be able to get better from the PNES. Doing a lot of housework or errands lead to complications like seizures or extreme fatigue all day. What do you guys think?",https://www.reddit.com/r/PNESsupport/comments/n6nsga/should_i_give_up_on_my_dream/
n22b6q,1619813476,Reading material I picked up from a doctor,"I finally got a diagnosis today. (Wooo!) While talking to the doctor, he not only went over issues related to the stigmas, what PNES was and a bunch of other things. When I brought up that my psychiatrist and counselors admitted they knew little about PNES, but would like more direction from the staff at the hospital, he suggested I have them read the book I will put below. \n\n\n\n\nAccording to him, it's been an incredible tool in the medical community for understanding and treating PNES, as well as patients learning to help themselves from it. I have not read it myself as I'm literally just getting home a little bit ago, but thought I'd share this with y'all since this doctor not only seemed VERY knowledgeable, with what little information there is out there about PNES, but he was very passionate about making sure I understood it but that I had resources to take care of myself and deal with the stigmas from medical professionals.\n\n\n\n\n\n""Taking Control of Your Seizures""\nAuthors:\nJoel Reiter\nDonna Andrews\nCharlotte Reiter\nW. Curt LaFrance Jr",https://www.reddit.com/r/PNESsupport/comments/n22b6q/reading_material_i_picked_up_from_a_doctor/
n1byhk,1619724094,What is CBT like for PNES?,"I have suffered from non epileptic seizures since I was a teenager and just recently started experiencing it again as an adult. I went back to a neurologist and they are wanting me to go back and do the video EEG again, but he also wants me to do CBT. I have never done this before and would like to know what to expect. As far as I know, I have not experienced any trauma that could be contributing to my seizures. I have done CBT for anxiety and depression, but not for seizures. Not sure how it works. Can someone tell me?",https://www.reddit.com/r/PNESsupport/comments/n1byhk/what_is_cbt_like_for_pnes/
n0m8hi,1619636833,Excessive sleep,"Anyone else suffer from episodes of excessive sleep after a particularly bad seizure? I sometimes sleep for 12-20 hours afterwards, and while it almost always occurs after a bad seizure, it sometimes happens instead of one (i.e. I feel it coming, but pass out before). Looking to see if there's a potential correlation, or if I've got something else to worry about too.",https://www.reddit.com/r/PNESsupport/comments/n0m8hi/excessive_sleep/
mzsg1g,1619541143,Lost,I feel like I’ve lost everything that made me me. I feel stuck. Lost. This wasn’t the way life was meant to be. I don’t know who to reach out to that could possibly understand.,https://www.reddit.com/r/PNESsupport/comments/mzsg1g/lost/
mxf2mh,1619249665,Do we know what is actually happening to in the brain during PNES? How come we have these events as opposed to a panic attack or some other expression of trauma/distress?,Title.,https://www.reddit.com/r/PNESsupport/comments/mxf2mh/do_we_know_what_is_actually_happening_to_in_the/
mxf1ou,1619249543,Does anyone not know what specific trauma caused their PNES/NEAD?,I find it challenging to identify what it was when I read about the disorder and other patients have one specific traumatic event as a cause.,https://www.reddit.com/r/PNESsupport/comments/mxf1ou/does_anyone_not_know_what_specific_trauma_caused/
mwzmwh,1619196646,Twitching,Does anyone get twitching as their only symptom of a seizure sometimes,https://www.reddit.com/r/PNESsupport/comments/mwzmwh/twitching/
mvzg0x,1619075850,First seizures (2 within 10 hours),"So Saturday night was the scariest moments of my fiancées life and my life as well, when she had her first seizure. She has anxiety and some other mental health diagnoses, but the anxiety has been triggering a lot more often lately after we moved to a different state and her health insurance has changed and could no longer see her therapist that she loved. This has caused her to not be able to have the CBT that she needs to keep her anxiety at bay. It has slowly been getting worse over about a year resulting in more frequent panic attacks. They are usually manageable and I’ve developed some of my own remedies that have helped her through them. Saturday was one of the best days we’ve had in a while and had an even better night together. Not a single time did anxiety arise and we were about to go to sleep when she said she starting to feel anxious and felt some tingling in her fingers which is uncommon, but happens time to time. I sat down next to her and the tingling spread up her arms then everywhere. That turn into numbness which has never happened then turned to can’t move limbs and quickly sent her into panic and it went from can’t move her leg, then arm and then she said she felt like she was going to pass out and her vision doubled or blurred, and then she stopped talking and moving completely while still conscious looking at me and her hands looked like they cramped as lobster claws and she tried to speak and it was slurred/mumbled and when I looked at her mouth I thought she was having a stroke. Her cheeks had a drooping look to them and hearing a mumble while I saw that, I jumped up and yelled she was having a stroke and went to pick her up to rush to the ER. She then mumbled a little clearer this time as I was lifting her, it’s a panic attack and this has happen before. I put her down and analyzed her face and again said you’re having a stroke, move your face and mouth, which she then could. She started slowly regaining mobility and was drenched from head to toe and I knew this was no panic attack. Over the next 4 -6 hours she had constant tremors, aggressive &amp; jerky limb thrashes mixed with head and eye movements that I knew were forms of seizures. They lessened as time went on and she eventually fell asleep, only to be woken by violent limb movements and screaming. Eventually lessened to a point that she could sleep. I watched her for another 6 hours without sleeping to make sure it didn’t happen again. The next day she felt terrible and we discussed everything that happened and I was convinced it was a mini stroke (TIA) followed by seizures. We decided she should go get checked out and immediately the tinge in her fingers came back. We quickly got ready and while I drove to the ER, it happened again, only this one didn’t paralyze her and she was more lethargic and had a slight slur or mumble but I could understand. I rushed her into a wheelchair and they quickly took her, pushed me out of the hospital because of Covid, and didn’t care much to hear what I saw and what happened. I called their line from outside and explained every detail to help them figure out what happened. About 6 hours later she was released after blood work and an EKG was done. They quickly chalked it up to a panic attack and low potassium. Which infuriated me beyond belief because my older brother growing up had twitching/tick seizures that most people would think aren’t seizures so I was sure of what those were. Her PCP today heard me out in detail from beginning to end and said it for sure was a seizure and probably combined with a panic attack and we are now about to Schedule an emergency visit to a neurologist to figure everything out. She explained different types of seizures and this one came up due to its correlation that I witnessed with the anxiety. I know this was very long, but we don’t know much about this stuff and I haven’t been able to sleep since it started (got 2 hours the last 2 nights), I’m just wondering if anyone has had any similarities between symptoms or if anyone has any advice or tips regarding important, possible life saving things to look for or do, and when to do them? Thank you for any advice or support with this. It is a new territory and I’m always the one with answers to calm her nerves and help her relax and I just don’t have answers.",https://www.reddit.com/r/PNESsupport/comments/mvzg0x/first_seizures_2_within_10_hours/
mvwtwn,1619063978,Diagnosed yeaterday,"After staying at a 24/7 eeg monitoring unit, I was diagnosed. On one hand, it was validating. Having an answer, and a validation of the trauma in my life lasting to this day with a family saying I'm crazy for things they've done; and believing them sometimes. But I cannot stop thinking about the trauma, especially living with my parents who are not great and defensive with the diagnosis. Has anyone else faced a fixation on trauma afterwards? Does it go away? What helped you cope?",https://www.reddit.com/r/PNESsupport/comments/mvwtwn/diagnosed_yeaterday/
mtj5yv,1618772791,Do remember the event?,\n\n[View Poll](https://www.reddit.com/poll/mtj5yv),https://www.reddit.com/r/PNESsupport/comments/mtj5yv/do_remember_the_event/
mte4vr,1618757083,Switching from a high-paying stressful job to a lower paying less stressful job…,The obvious benefit in this situation is less stress. But then stress comes from having less income and the financial issues that come along with that. \n\nAnyone out there ever been in this kind of situation? Anyone have good advice on how to decide which way to go?,https://www.reddit.com/r/PNESsupport/comments/mte4vr/switching_from_a_highpaying_stressful_job_to_a/
mqiyks,1618373616,Diet change + alternatives,"Hello! I wanted to know if anyone’s diet has changed since their diagnosis and development. Also, does anyone have alternatives to caffeine drinks? I need the energy but caffeine has a negative effect on me.",https://www.reddit.com/r/PNESsupport/comments/mqiyks/diet_change_alternatives/
mjmewb,1617500961,"After a seizure - an ongoing feeling of being in a daze, like you got hit in the head with something?",For me this might last for only a little while and sometimes for a whole day or two. Anyone else experience this?,https://www.reddit.com/r/PNESsupport/comments/mjmewb/after_a_seizure_an_ongoing_feeling_of_being_in_a/
