id,created_utc,title,selftext,full_link
mi89md,1617321106,How helpful is Cognitive Behavioral Therapy (CBT) for PNES?,"With the reading I’ve done lately about those with a PNES diagnosis, CBT seems to be the most mentioned treatment as a go to solution for PNES. Anyone have experience with CBT?",https://www.reddit.com/r/PNESsupport/comments/mi89md/how_helpful_is_cognitive_behavioral_therapy_cbt/
mi0vg4,1617299500,Anisocoria!,Anyone else get anisocoria (uneven pupils) before during or after a seizure?,https://www.reddit.com/r/PNESsupport/comments/mi0vg4/anisocoria/
mgcyzb,1617100526,Recently diagnosed,"Being recently diagnosed has left me confused. So grateful for the diagnosis and treatments to further my recovery, yet struggling to understand 4 years after the traumatic situation. \nWriting helps me to process..\nHope this helps someone else as well. ❤\n\n\n****I'm torn between understanding this is a ""medical condition "" and ""its just something that happens"".\nLosing a sense of who I am, where I am, and why i am even there.\nBrought back to a different place. A relam of in between- exhausted, anxious, trembling, stuck.\nFinding the best possible way to endure it- to lay, still, locked in time without a noticing eye or word. \nFollowing my bodys prompts- ""danger"", ""shut down"", ""stop"", ""panic"".\nHow does one live a life of greatness while fighting back the void into which they are trapped? \nBenefits of living. Physical denial. Mental release. \nI once was there but am no longer. \nI am once again fighting the trauma.\nSo much to understand. \nToo much to handle.\nFighting for me to be myself. ****\n-GD",https://www.reddit.com/r/PNESsupport/comments/mgcyzb/recently_diagnosed/
mfquca,1617028368,Brief seizures,"Hi, just wondered if anyone here with PNES experiences short brief seizures. Like seconds to minutes long. And what they’re like. Do you have any physical symptoms like twitching, arm going dead etc etc etc...",https://www.reddit.com/r/PNESsupport/comments/mfquca/brief_seizures/
mfg9vf,1616986755,How bad does stress have to be to trigger a PNES seizure?,"On a scale of 1 to 10, I’ve had numerous instances of stress at a 2 or 3 which would ordinarily be pretty easy to handle but yet I have a seizure. Anyone else get triggered so easily over small things and have a seizure?",https://www.reddit.com/r/PNESsupport/comments/mfg9vf/how_bad_does_stress_have_to_be_to_trigger_a_pnes/
menqrw,1616882422,Post seizure/event,"Does anyone here get like after seizure tiredness, dizziness, pupil dilation etc etc",https://www.reddit.com/r/PNESsupport/comments/menqrw/post_seizureevent/
m65jk3,1615888756,Deja vu,"Anyone else get Deja vu related to their PNES and not epilepsy. Aswell as twitching, visual disturbances, dizziness etc",https://www.reddit.com/r/PNESsupport/comments/m65jk3/deja_vu/
m556me,1615758571,Weird symptoms,"DEA have seizures where their arms, or one of their arms just shakes but they are conscious.",https://www.reddit.com/r/PNESsupport/comments/m556me/weird_symptoms/
m3lqx5,1615568090,DAE get a little twitch from time to time?,"Sometimes i involuntarily twitch, it doesn’t hurt, people used to make fun of it in high school lol just curious if its related to PNES",https://www.reddit.com/r/PNESsupport/comments/m3lqx5/dae_get_a_little_twitch_from_time_to_time/
m3i3g9,1615557578,Anisocoria during seizures,"Hi, just wondering if anyone else gets anisocoria (uneven pupils) during a PNES.",https://www.reddit.com/r/PNESsupport/comments/m3i3g9/anisocoria_during_seizures/
lkm69y,1613420441,After seizure pain tips?,"Do you guys also experience insane muscle pain after seizures? I had multiple seizures this day, one lasted an hour. And now my pain is so bad that I can't even walk, but I have school tomorrow.\nHow do y'all deal with this? Any tips?",https://www.reddit.com/r/PNESsupport/comments/lkm69y/after_seizure_pain_tips/
ljdnno,1613264182,Headaches from caffeine?,"Hi everyone! I am new to Reddit but just wanted to say I was diagnosed with PNES last year. Since then I’ve been very ill missing school, letting go of job, and I can’t do the simplest thing. I’m not sure if the ice pick headaches are normal but I’ve been getting a lot of them. Does anyone know to treat them or ways to reduce/prevent them from happening? I suspect it’s my aura which I experience a lot. Today I started to feel weird after drinking vitamin water (the brand) and I found out it has caffeine in it lol. I think that’s what caused me to have stabbing pins in the center of my head. I tried to put a heat warmer but that only triggers a seizure. I can’t massage or rub it :(",https://www.reddit.com/r/PNESsupport/comments/ljdnno/headaches_from_caffeine/
liyrcw,1613215086,a breakdown of my symptoms and medical history for anyone interested,"Just learned I might be suffering from PNES. I'm like 98% sure that is what is going on, but I'm just starting my research.\n\n&amp;#x200B;\n\nWhen I was 16-17 I started getting very occasional ""tics"". it would usually start with my thoughts spinning out of control, accelerating and then culminating in my whole body shaking. It wasn't repeated shaking. Just one ""flash"". I remember telling my parents, who are usually very engaged and understanding and I remember feeling odd that they didn't seem to take it seriously at all. Like it was something commonplace I had described. \n\n&amp;#x200B;\n\nWhen I moved out from home at 21 (to study) my life would quite quickly deteriorate. When I was 23 or 24 (I'm very bad at placing events in time with any sort of accuracy) I was hospitalized with a diagnosis of Schizophrenia Simplex. A diagnosis I have never felt was very accurate. Leading up till this point I had self-medicated with weed. I would get ""brain storms"" where my thoughts would spin out of control and I would get the ""tic"" but now it would repeat and repeat. When I was younger the ""tic"" would sorta ""shake me out of it"" but now it would just repeat. I guess it must have looked like a seizure. I'm 35 now and have been in almost constant treatment ever since. I've seen an army of psychologists, psychiatrists, doctors and other experts. None of them has ever been the least bit interested in my reports of these symptoms. Not at all. Not once. We've been working on my traumas, my strategies, I've been on medication and I've come a long way. But the PNES has never gotten better - only worse TBH.\n\n&amp;#x200B;\n\nMy brother suggested I might be suffering from ADHD or ADD and I went to a new psychiatrist to explore this. For some reason I decided to insist on explaining the PNES symptoms (I didn't yet know PNES existed). At first he dismissed it like everybody else but I insisted. ""No, you don't get it. I get seizures. I end up shaking on the ground with my eyes rolling back in my head, crying, almost completely unable to speak or think. It is tremendously painful. Not physically painful but psychologically. It is a very big symptom. IT MUST MEAN SOMETHING.""\n\n&amp;#x200B;\n\nI got through and he thought it best to schedule and EEG. He didn't say anything about PNES and my guess is he does know what it is at all.\n\n&amp;#x200B;\n\nYesterday my SO was desperate because I've had PNES every day for 10 days or so. She searched my symptoms on google and found out about PNES. Today I've been reading up on it and found this place. \n\n&amp;#x200B;\n\nIs PNES very rare or something? Or what is it about these symptoms that make all the freaking experts just dismiss it out of hand? Does anybody else have a similar history? \n\n&amp;#x200B;\n\nMy symptoms are almost always connected to stress. I have traumas and a lot of psychological symptoms that nobody has ever been able to diagnose with any degree of accuracy (to my mind). it seems that uncertainty is a major factor. If somebody asks me a question (while I'm stressed or close to a PNES attack) where I have to go over multiple scenarios in my mind to come up with an answer, it's almost certain I'll get the PNES. It is like my brain cannot deal with the chaos. Like it cannot make order of the world - like there is just too much information - too many possibilities... And then it just melts down. \n\n&amp;#x200B;\n\nFeel free to ask me questions or comment with whatever you like.",https://www.reddit.com/r/PNESsupport/comments/liyrcw/a_breakdown_of_my_symptoms_and_medical_history/
liem02,1613147434,Does anyone else feel like this is a bullshit illness?,"I feel like this illness is bullshit. I feel like we are treated as though we are not real people. I think that all of the appointments and therapy to feel connected to our mind and body to heal within are all our responsibility. Yet we desperately are asking for help from experts. Recognizing they are nonexistent. \n\nI don’t think or feel this illness is not real. It is very real. We suffer the consequences of it everyday. We live a life of our own making, while dealing and coping with all of what life has to give. This is just what we get to deal with everyday. No ways of masking or treating, just accept the suffering while you heal yourself. \n\nI have love and support, but I don’t love what is happening to me. I feel that I want to be symptom free, I feel that I have to use every tool possible to explore the underground cave I’m in without an oxygen tank. I have to grow gills and learn to breathe while skin diving in the dark. I have to sit with feelings that serve no purpose. To feel how scary or useless they are and swim around them and normalize it in life. Yet thinking this a boring old show I’ve seen before. Why the hell do I have to watch it again. I get it, this feels hopeless of ever getting symptom free. But my goodness, I won’t that feeling win over me. I must have hope that this will one day end. Rest assured, it will. \n\n\nI feel like this whole illness is put on our shoulders, and  we get to resemble ourselves, suffering with symptoms but feeling like we can beat the unknown. \n\nExplore within and be nice to yourself. Cause as much as life can suck, we don’t. There is beauty in the simplest of offerings in the world. \n\nSymptom free or not your feelings and thoughts matter. You are real. This is our reality. I feel disappointed that I have to accept this reality. I hope you don’t feel like you are suffering alone. \n\nFrom one to another. A good day, a bad, it’s just another day. But I’m smiling at you, and holding your hand, to let you know, I’m here too.",https://www.reddit.com/r/PNESsupport/comments/liem02/does_anyone_else_feel_like_this_is_a_bullshit/
lbqgfx,1612367302,WHY the F*** would anyone fake this?,Why are we being ignored? I’m fucking sick of this shit. We deserve to be recognised and treated.,https://www.reddit.com/r/PNESsupport/comments/lbqgfx/why_the_f_would_anyone_fake_this/
lbolx3,1612362314,Hello guys!,Hey guys I’m new to this group. Just joined cause recently it’s been hard for me. \nI’ve had PNES for about a year and a half now. I’ve taken some medications here and there none seem to help so we got off them. \nMine are stress triggered thank god. So I can almost use coping and relaxing methods to keep my days going. I have maybe one seizure a month now but was having 20+ a day for 6 months straight. \nI’m about 1 week in on not being at work due to it coming back and affecting me once more. \nIt’s mostly just a tick now than a seizure. I’ll tick when I get stressed. Or seize when I’m super stressed. \nI’m writing all this for those who have this to keep strong through it. I was feeling awful this morning saw this group and it relieved me a bit. \nIf anyone needs anything I’m always here for everyone and anyone. \nI’ve had it came back played a year of semi pro ball with it and got an amazing job. I clawed my way back up from the amazing support which has since disappeared in the last year. \nI’ll be anyone’s support!,https://www.reddit.com/r/PNESsupport/comments/lbolx3/hello_guys/
l8tvfz,1612035924,Possible PNES from Epstein Barr Virus?,        I'm not sure what is going on but Ive been having issues with tremmors in my hands and muscle twitches. The weirdest one is the rapid blinking. It usually leaves me dizzy and the last time I had this it happened for a minute or so for like no reason and I ended up sticking my head in a corner because it made me fall a bit. I remember everything but it was very in and out of focus. My vision is the symtom that alway sticks around. I feel like im a circus fun house or something I guess and I can't look at intricate patterns for they will move and stretch.\n      I can't trust my vision for things grow weird in distortion and size.  I dont have as much fake thoughts anymore though. Usually after I have an episode I will think confusing things like pandabears are going to space for no reason or just mumbo jumbo that doenst make sense and other voices. I usually promptly forget them after but some of them stick with me. Its strange and I don't like it. I havent had an epsiode in awhile though and I just did the other day. Now I just feel wired and I dont know what it is! I'm always conscious but like. Not there. Or overly there in my mind. Emotions are too intense and I have no control.Does anyone have insight?\n     I got Epstein Barr Virus in the summer time and that's when the weirdness started happening. Idk if they are seizures or what. My old doctors wouldn't let me get an EEG. They just sent me to a psychologist because I have a lot of truama. Now I'm in a new city and I'm waiting on new doctors.,https://www.reddit.com/r/PNESsupport/comments/l8tvfz/possible_pnes_from_epstein_barr_virus/
l3bhee,1611405976,"I only just found this song called P.N.E.S idk if it was ever shared here before, but I find it amazing and I feel incredibly understood",,https://www.reddit.com/r/PNESsupport/comments/l3bhee/i_only_just_found_this_song_called_pnes_idk_if_it/
l0oue2,1611078061,My neurologist thinks I have PNES,"Looking for some answers\n\nI went to my Dr for what I thought was diabetes about two years ago. I felt like I'd have blood sugar spikes that would make things fuzzy, mood swings, and confused, peeing more than usual, and fatigue. I also had a couple of infections that weren't healing properly. Diabetes run in my family, so I figured we should look into this, as I am overweight as well. Husband thought I was having seizures as I was unresponsive in these episodes, and afterwards was pretty out if it.\n\nDiabetes test negative so Primary Dr refers to Neurologist. Neurologist orders test. EEG and MRI. Asks me to keep a journal. While there were some concerns that I had (for example they found a cyst on my basal ganglia likely benign). The neurologist never called me back with my results for MRI and EEG triggered what I believed to be a seizure. My husband had to come and pick me up from the hospital were the procedure was performed. That week afterwards was hell, and my symptoms started to get worse. I now couldn't talk and started to get weakness on my left side. I was so sure that something would pop up on test.  No call for neurologist, no improvements in symptoms for another week. We tries calling them. Couldn't get ahold of them. Finally the Nurse calls me back and says my tests were all normal.\n\nI'm continuing to have have seizures, worsening about a week before my period according to my journal. I had another flare up the week of the Christmas/New Years Holidays. Saturday I had an absence seizure, and Sunday morning  I started to get pins and needles on the left side of my face, and the my left eye starts to droop. I get paralysis on my left side. My husband takes me to the ER. We thought I was having a stroke. Test for that is negative. While in the hospital my husband and I expressed our concerns about my neurologist lack of communication with us on. We honestly believe I was having seizures, and that I was having a stroke.  My boss who is an epileptic is the one who told me that I shouldn't drive after having what we believed what I was a seizure at work! \n\nI am going to seek a second opinion, and see another neurologist. After my last appointment, my neurologist just berated me and just made me feel awful for what's going on. Still didn't offer me any information other than telling me I had conversion disorder, which led me to do some reflecting, research, and here. Im still not officially diagnosed. I found this website to be useful http://www.nonepilepticattacks.info/2_feel_like.html",https://www.reddit.com/r/PNESsupport/comments/l0oue2/my_neurologist_thinks_i_have_pnes/
l01r2l,1610998107,Riding a bike?,"Hey everyone,\n\nI've recently been diagnosed with pnes. I've had prett bad ones for about a year and lately I've even had multiple in a day. Because of this I quit my job and don't drive at all anymore. I also have depression anxiety &amp; may have adhd and/or bipolar (according to therapist and past doctor). I've been feeling extremely down and depressed and been staying in bed all day. I don't shower for days and days. I've been doing adult coloring, trying to journal and taking online classes. I want to do something that may help me feel better and I know exercise is a major thing. However I have no motivation and I'm too anxious to exercise around other people. I tried walking but I barely have motivation for it. So I was thinking I'd start biking around the neighborhood a bit and I'm looking to buy a bike. However my husband is worried about me getting episodes while riding...what do you guys think? I think it'll be easier to stop the bike than a car of course and not as dangerous, plus I could go to nearby park which has bike trails to ride.",https://www.reddit.com/r/PNESsupport/comments/l01r2l/riding_a_bike/
kzuyzs,1610977719,PNES and school,"Has anyone of you ever had trouble in school because of their seizures? Most of my teachers get annoyed by having to ""work around me"" (which basically means leaving the room together with the other students while I have a seizure and then coming back in and continuing the lesson when I'm okay again). My school nurse said this is too much for my classmates and I should stay at home. I once was sent home against my will after a seizure, I wanted to stay in class so badly, I just needed a few minutes break.\n\nI attend a higher technical college for interior design but we also do a bit of joinery work, now they won't let me work on machines in school, which we don't even do a lot cuz we mostly work by hand. But when I don't work in machines my teacher let's me fail the subject and then I have to leave the school without a degree.\n\nI am so exhausted. I only started having seizures in summer last year and since then my school is causing so many problems. I wanted to work in interior design since I was 5 years old. PNES is taking that away from me. If they throw me out of school I'll have wasted the past 4 years studying interior design and I won't have a degree. My teachers won't let me explain my situation to them, how my seizures get caused by triggers, etc.\n\nI'd love to hear about anyone's experience with PNES and school, positive and negative.",https://www.reddit.com/r/PNESsupport/comments/kzuyzs/pnes_and_school/
kyn52n,1610818147,I have a question about NES please :),"Hello anyone reading this,\n\nFirstly I just wanted to let you know, before I ask my question, if anybody wants to talk about anything, I am here. I dont have any qualifications or anything like that, except I am a friendly face that may not be able to help, but sometimes I feel that you saying it and not expecting anything back could be helpful for my NES. \n\nNow for my question 😃\n\nI have been having NES for a bit less than a year, and diagnosed about a month ago. All my NES seizures I call ‘blackouts’ because thats what happens. Usually I’m absolutely fine afterwards, but the other day after a 10 minute blackout, I’de forgotten a lot about that day... does this happen to anyone else?\n\nThank you, and thank you very much to whoever set this subreddit up, it will be very helpful to me and I assume very much to others aswell!",https://www.reddit.com/r/PNESsupport/comments/kyn52n/i_have_a_question_about_nes_please/
kymqxg,1610816948,I’m just mad.,"I been having seizures more frequently lately. They’ve been getting worse in length and violence. (Idk if that’s the right word) when i have them lately they won’t stop unless I’m given medication and I’m so out of it so i don’t respond to anything but can still hear and see. \nI’ve been to the hospital twice. This last time i assume they didn’t know i can hear/see them ..(kinda, my eyes are usually fixed on something) one lady said “she probably comes here to get out of work” the other “poor girl”. \nLater on after coming around my boyfriend told me what they asked and said. They asked “did anyone witness the seizures” (i was at work and picked up by paramedics) they said more but i forgot what. \nI just hate going to the doctors as well as the hospital because i feel like they don’t take it seriously or believe anything i say. What they say as well as what they do shows me that they don’t. Why would i come here to get out of work. Why would i go in a ambulance to get out of work. Why do you think no one witnessed it. It really pisses me off. \n\nDo y’all deal with the same reactions?",https://www.reddit.com/r/PNESsupport/comments/kymqxg/im_just_mad/
kxv2jn,1610719227,Had a seizure at my new job today and I feel so bad about it.,"So I had my first seizure of 2021 at my new job today. :( I felt very embarrassed but luckily my co-workers and my boss were very helpful and considerate. I didn’t disclose the fact that I get seizures when I applied for the job because I was scared that I wouldn’t get it. I’m glad that my colleagues acted so swiftly and tried to not make me feel bad about it but I feel defeated. Just got home now, replaying the day and I once again just realized how much I hate this illness. (I only get a few in a year but why did it have to start off like this?)",https://www.reddit.com/r/PNESsupport/comments/kxv2jn/had_a_seizure_at_my_new_job_today_and_i_feel_so/
kwhwr5,1610549526,"Hi, need help with night seizures","Hi my name is Neptune, I have been living with PNES for about 3 years now. In the last year or so I have started to have seizures in the middle of the night and waking up in full seizure. I know a few of my triggers and I avoid them like the plague, but I still have know idea what are cause the ones in my sleep. Now it is starting to affect my school life, I am in so much pain some morning I can barely move and no matter how much coffee or tea I just can't wake up I feel like I have no energy. I have no idea how long these seizures last as well. I have brought it up with my trauma therapist and she doesn't know what to do since I can't tell what cause them. I need help.",https://www.reddit.com/r/PNESsupport/comments/kwhwr5/hi_need_help_with_night_seizures/
klt6yy,1609171667,"Does anyone here work? If so, what do you do?","My partner doesn't currently work, she has PNES with seizures every couple of days to every couple of weeks.\n\nI have told her not to work and let me worry about money, but in reality I'm scared of her going to work. But I'm wondering if she needs too. Could it help her?? \n\nI don't want her in a vulnerable position. It makes me anxious. I wish I could take all this away from her 😔\n\nIf you don't work, do you claim any benefits? UK.",https://www.reddit.com/r/PNESsupport/comments/klt6yy/does_anyone_here_work_if_so_what_do_you_do/
khnu9c,1608577681,I’m at a loss,"Hello,\n\nI am new to the group and am so happy to have found it. I’ve been looking for a support group for PNES since I was diagnosed with it 3 years ago. I was doing really well until about a week ago. Now I’m drowning. What are some of your tips and tricks for coping with PNES when it flares up? Mine no longer seem to work.\n\nThank you!",https://www.reddit.com/r/PNESsupport/comments/khnu9c/im_at_a_loss/
